{
  "authority_write": false,
  "candidate_counts": {
    "decisions": 1,
    "evidence": 1,
    "global_candidates": 1,
    "open_tasks": 1,
    "questions": 1
  },
  "capture_mode": "ASSISTED",
  "closure_digest": "61d1d257e1a5ae61c52f43b820f5ca69561b9303da2c669a6930a6535daad3b7",
  "closure_id": "closure:10000000-0000-4000-8000-000000000001",
  "created_at": "2026-07-24T03:00:01Z",
  "global_outbox_state": "pending_review",
  "global_write": false,
  "project_id": "v2-fixture",
  "project_write_state": "pending_review",
  "proposal_digest": "72fc02e1a40de95b24726f594f7b3aad8e018c9c47795ad7e873b31311b1106f",
  "proposal_id": "closure-proposal:10000000-0000-4000-8000-000000000307",
  "schema_version": 1
}
